
mysql> create database practice;
Query OK, 1 row affected (0.05 sec)



mysql> show databases;
+--------------------+
| Database           |
+--------------------+
| information_schema |
| bcits              |
| mysql              |
| performance_schema |
| practice           |
| sys                |
+--------------------+
6 rows in set (0.08 sec)

mysql> use practice;
Database changed

mysql> create table student
    -> (id int(3) not null unique primary key,
    -> name varchar(100) not null,
    -> marks double not null,
    -> mobile int(10) not null,
    -> email varchar(150) not null
    -> );
Query OK, 0 rows affected (0.31 sec)

 insert into student
    -> values(10,'prashul',66.3,990134897,'prashul@gmail.com');
Query OK, 1 row affected (0.08 sec)

mysql> insert into student
    -> values(20,'dev',76,995348957,'dev@gmail.com');
Query OK, 1 row affected (0.08 sec)

mysql> insert into student
    -> values(30,'shetty',66,991148957,'shetty@gmail.com');
Query OK, 1 row affected (0.36 sec)

mysql> insert into student
    -> values(40,'ashin',69,999134897,'ashin@gmail.com');
Query OK, 1 row affected (0.06 sec)

mysql> insert into student
    -> values(50,'shul',46,995348957,'shul@gmail.com');
Query OK, 1 row affected (0.08 sec)



mysql> select * from student;
+----+---------+-------+-----------+-------------------+
| id | name    | marks | mobile    | email             |
+----+---------+-------+-----------+-------------------+
| 10 | prashul |  66.3 | 990134897 | prashul@gmail.com |
| 20 | dev     |    76 | 995348957 | dev@gmail.com     |
| 30 | shetty  |    66 | 991148957 | shetty@gmail.com  |
| 40 | ashin   |    69 | 999134897 | ashin@gmail.com   |
| 50 | shul    |    46 | 995348957 | shul@gmail.com    |
+----+---------+-------+-----------+-------------------+
5 rows in set (0.00 sec)

mysql> delete from student
    -> ;
Query OK, 5 rows affected (0.11 sec)

mysql> select * from student;
Empty set (0.00 sec)


mysql> insert into student
    -> values(40,'ashin',69,999134897,'ashin@gmail.com');
Query OK, 1 row affected (0.06 sec)

mysql> insert into student
    -> values(30,'shetty',66,991148957,'shetty@gmail.com');
Query OK, 1 row affected (0.08 sec)

mysql> insert into student
    -> values(20,'dev',76,995348957,'dev@gmail.com');
Query OK, 1 row affected (0.03 sec)

mysql> insert into student
    -> values(10,'prashul',66.3,990134897,'prashul@gmail.com');
Query OK, 1 row affected (0.03 sec)

mysql> select * from student;
+----+---------+-------+-----------+-------------------+
| id | name    | marks | mobile    | email             |
+----+---------+-------+-----------+-------------------+
| 10 | prashul |  66.3 | 990134897 | prashul@gmail.com |
| 20 | dev     |    76 | 995348957 | dev@gmail.com     |
| 30 | shetty  |    66 | 991148957 | shetty@gmail.com  |
| 40 | ashin   |    69 | 999134897 | ashin@gmail.com   |
+----+---------+-------+-----------+-------------------+
4 rows in set (0.00 sec)

mysql> update student
    -> set id = 50
    -> where id = 40;
Query OK, 1 row affected (0.16 sec)
Rows matched: 1  Changed: 1  Warnings: 0

mysql> select * from student;
+----+---------+-------+-----------+-------------------+
| id | name    | marks | mobile    | email             |
+----+---------+-------+-----------+-------------------+
| 10 | prashul |  66.3 | 990134897 | prashul@gmail.com |
| 20 | dev     |    76 | 995348957 | dev@gmail.com     |
| 30 | shetty  |    66 | 991148957 | shetty@gmail.com  |
| 50 | ashin   |    69 | 999134897 | ashin@gmail.com   |
+----+---------+-------+-----------+-------------------+
4 rows in set (0.00 sec)
 alter table student1
    -> drop column marks;


mysql> select * from student1;
+----+-------+-----------+----------------+
| id | name  | mobile    | email          |
+----+-------+-----------+----------------+
| 30 | shhh  | 901348957 | sh@gmail.com   |
| 40 | shu1l | 901348957 | sh@gmail.com   |
| 50 | shul  | 950134957 | shul@gmail.com |
+----+-------+-----------+----------------+
3 rows in set (0.00 sec)

mysql> desc student1;
+--------+--------------+------+-----+---------+-------+
| Field  | Type         | Null | Key | Default | Extra |
+--------+--------------+------+-----+---------+-------+
| id     | int(3)       | NO   | PRI | NULL    |       |
| name   | varchar(100) | NO   |     | NULL    |       |
| mobile | int(10)      | NO   |     | NULL    |       |
| email  | varchar(150) | NO   |     | NULL    |       |
+--------+--------------+------+-----+---------+-------+
4 rows in set (0.00 sec)
mysql> create database newdata;
Query OK, 1 row affected (0.01 sec)

create table newtable
    -> (id int not null,
    -> name varchar(20)
    -> );
Query OK, 0 rows affected (0.54 sec)

mysql> truncate table newtable;
Query OK, 0 rows affected (0.47 sec)


mysql> drop database newdata;
Query OK, 0 rows affected (0.30 sec)


mysql> select * from student1;
+-------+-------+-----------+----------------+
| idnew | name  | mobile    | email          |
+-------+-------+-----------+----------------+
|    30 | shhh  | 901348957 | sh@gmail.com   |
|    40 | shu1l | 901348957 | sh@gmail.com   |
|    50 | shul  | 950134957 | shul@gmail.com |
+-------+-------+-----------+----------------+
3 rows in set (0.00 sec)

mysql> rename table student1 to student2;
Query OK, 0 rows affected (0.45 sec)

mysql>  show databases;
+--------------------+
| Database           |
+--------------------+
| information_schema |
| bcits              |
| mysql              |
| performance_schema |
| practice           |
| sys                |
+--------------------+
6 rows in set (0.00 sec)

mysql> use practice;
Database changed
mysql> show tables;
+--------------------+
| Tables_in_practice |
+--------------------+
| newtable           |
| student            |
| student2           |
+--------------------+
3 rows in set (0.00 sec)

mysql> use practice;
Database changed
mysql> create table dept
    -> (deptid int not null unique,
    -> deptname varchar(20) not null
    -> );
Query OK, 0 rows affected (0.36 sec)

mysql> desc dept;
+----------+-------------+------+-----+---------+-------+
| Field    | Type        | Null | Key | Default | Extra |
+----------+-------------+------+-----+---------+-------+
| deptid   | int(11)     | NO   | PRI | NULL    |       |
| deptname | varchar(20) | NO   |     | NULL    |       |
+----------+-------------+------+-----+---------+-------+
2 rows in set (0.00 sec)


mysql> desc dept;
+----------+-------------+------+-----+---------+-------+
| Field    | Type        | Null | Key | Default | Extra |
+----------+-------------+------+-----+---------+-------+
| deptid   | int(11)     | NO   | PRI | NULL    |       |
| deptname | varchar(20) | NO   |     | NULL    |       |
+----------+-------------+------+-----+---------+-------+
2 rows in set (0.00 sec)

mysql> insert into dept
    -> values(10,'shul');
Query OK, 1 row affected (0.07 sec)

mysql> insert into dept
    -> values(20,'prashul');
Query OK, 1 row affected (0.06 sec)

mysql> insert into dept
    -> values(30,'shetty');
Query OK, 1 row affected (0.07 sec)

mysql> insert into dept
    -> values(40,'shetty1');
Query OK, 1 row affected (0.11 sec)

mysql> select * from dept;
+--------+----------+
| deptid | deptname |
+--------+----------+
|     10 | shul     |
|     20 | prashul  |
|     30 | shetty   |
|     40 | shetty1  |
+--------+----------+
4 rows in set (0.00 sec)


mysql> alter table dept
    -> add location varchar(20);
Query OK, 0 rows affected (0.58 sec)
Records: 0  Duplicates: 0  Warnings: 0

mysql> desc dept;
+----------+-------------+------+-----+---------+-------+
| Field    | Type        | Null | Key | Default | Extra |
+----------+-------------+------+-----+---------+-------+
| deptid   | int(11)     | NO   | PRI | NULL    |       |
| deptname | varchar(20) | NO   |     | NULL    |       |
| location | varchar(20) | YES  |     | NULL    |       |
+----------+-------------+------+-----+---------+-------+
3 rows in set (0.00 sec)



mysql> update dept
    -> set location ='a'
    -> where deptid = 10;
Query OK, 1 row affected (0.07 sec)
Rows matched: 1  Changed: 1  Warnings: 0

mysql> update dept
    -> set location ='b'
    -> where deptid = 20;
Query OK, 1 row affected (0.36 sec)
Rows matched: 1  Changed: 1  Warnings: 0

mysql> update dept
    -> set location ='c'
    -> where deptid = 30;
Query OK, 1 row affected (0.08 sec)
Rows matched: 1  Changed: 1  Warnings: 0

mysql> update dept
    -> set location ='d'
    -> where deptid = 40;
Query OK, 1 row affected (0.07 sec)
Rows matched: 1  Changed: 1  Warnings: 0


mysql> select * from dept;
+--------+----------+----------+
| deptid | deptname | location |
+--------+----------+----------+
|     10 | shul     | a        |
|     20 | prashul  | b        |
|     30 | shetty   | c        |
|     40 | shetty1  | d        |
+--------+----------+----------+
4 rows in set (0.00 sec)

vmysql> select  30 +20;
+--------+
| 30 +20 |
+--------+
|     50 |
+--------+
1 row in set (0.06 sec)

mysql> update dept
    -> set location = 'z'
    -> where deptid = 40 ;
Query OK, 1 row affected (0.08 sec)
Rows matched: 1  Changed: 1  Warnings: 0

mysql> select * from dept;
+--------+----------+----------+
| deptid | deptname | location |
+--------+----------+----------+
|     10 | shul     | a        |
|     20 | prashul  | b        |
|     30 | shetty   | c        |
|     40 | dev      | z        |
+--------+----------+----------+
4 rows in set (0.00 sec)

mysql> update dept
    -> set location = 'a'
    -> where deptid = 40 ;
Query OK, 1 row affected (0.08 sec)
Rows matched: 1  Changed: 1  Warnings: 0

mysql> select * from dept;
+--------+----------+----------+
| deptid | deptname | location |
+--------+----------+----------+
|     10 | shul     | a        |
|     20 | prashul  | b        |
|     30 | shetty   | c        |
|     40 | dev      | a        |
+--------+----------+----------+
4 rows in set (0.00 sec)

mysql> select distinct location from dept;
+----------+
| location |
+----------+
| a        |
| b        |
| c        |
+----------+
3 rows in set (0.06 sec)


mysql> select distinct location,deptname  from dept;
+----------+----------+
| location | deptname |
+----------+----------+
| a        | shul     |
| b        | prashul  |
| c        | shetty   |
| a        | dev      |
+----------+----------+
4 rows in set (0.00 sec)

mysql>

mysql> select distinct location,deptname  from dept;
+----------+----------+
| location | deptname |
+----------+----------+
| a        | shul     |
| b        | prashul  |
| c        | shetty   |
+----------+----------+
3 rows in set (0.00 sec)

mysql> select location loc from dept dept1;
+------+
| loc  |
+------+
| a    |
| b    |
| c    |
| a    |
+------+
4 rows in set (0.00 sec)
mysql>
mysql> select * from dept;
+--------+----------+----------+
| deptid | deptname | location |
+--------+----------+----------+
|     10 | shul     | a        |
|     20 | prashul  | b        |
|     30 | shetty   | c        |
|     40 | shul     | a        |
+--------+----------+----------+
4 rows in set (0.00 sec)

mysql> select 4 + 6;
+-------+
| 4 + 6 |
+-------+
|    10 |
+-------+
1 row in set (0.00 sec)

from dept' at line 3
mysql> select deptid+10
    -> from dept;
+-----------+
| deptid+10 |
+-----------+
|        20 |
|        30 |
|        40 |
|        50 |
+-----------+
4 rows in set (0.00 sec)

mysql>
mysql> select * from dept where deptid >20 and location ='a';
+--------+----------+----------+
| deptid | deptname | location |
+--------+----------+----------+
|     40 | shul     | a        |
+--------+----------+----------+
1 row in set (0.03 sec)


mysql> desc employee_info;
+-------------+--------------+------+-----+---------+-------+
| Field       | Type         | Null | Key | Default | Extra |
+-------------+--------------+------+-----+---------+-------+
| eid         | int(5)       | NO   | PRI | NULL    |       |
| name        | varchar(150) | YES  |     | NULL    |       |
| mobile      | mediumtext   | YES  |     | NULL    |       |
| emaiid      | varchar(150) | YES  |     | NULL    |       |
| dob         | date         | YES  |     | NULL    |       |
| designation | varchar(150) | YES  |     | NULL    |       |
| salary      | double       | YES  |     | NULL    |       |
| deptid      | int(5)       | YES  |     | NULL    |       |
| doj         | date         | YES  |     | NULL    |       |
| bloodgroup  | varchar(150) | YES  |     | NULL    |       |
| gender      | varchar(150) | YES  |     | NULL    |       |
+-------------+--------------+------+-----+---------+-------+
11 rows in set (0.00 sec)

mysql> create table employee_info
    -> (eid int(5) not null unique primary key,
    -> name varchar(150) ,
    -> mobile long ,
    -> emaiid varchar(150),
    -> dob date,
    -> designation varchar(150),
    -> salary double,
    -> deptid int(5),
    -> doj date,
    -> bloodgroup varchar(150),
    -> gender varchar(150)
    -> );
Query OK, 0 rows affected (0.27 sec)

mysql> desc employee_info;
+-------------+--------------+------+-----+---------+-------+
| Field       | Type         | Null | Key | Default | Extra |
+-------------+--------------+------+-----+---------+-------+
| eid         | int(5)       | NO   | PRI | NULL    |       |
| name        | varchar(150) | YES  |     | NULL    |       |
| mobile      | mediumtext   | YES  |     | NULL    |       |
| emaiid      | varchar(150) | YES  |     | NULL    |       |
| dob         | date         | YES  |     | NULL    |       |
| designation | varchar(150) | YES  |     | NULL    |       |
| salary      | double       | YES  |     | NULL    |       |
| deptid      | int(5)       | YES  |     | NULL    |       |
| doj         | date         | YES  |     | NULL    |       |
| bloodgroup  | varchar(150) | YES  |     | NULL    |       |
| gender      | varchar(150) | YES  |     | NULL    |       |
+-------------+--------------+------+-----+---------+-------+
11 rows in set (0.00 sec)



mysql> insert into employee_info
    -> values(10,'prashul',9901348957,'prashul@gmail.com','2000-01-01','develper',20000,10,'2019-02-01','o+','m');
Query OK, 1 row affected (0.34 sec)

mysql> insert into employee_info
    -> values(20,'dev',9901348967,'dev@gmail.com','2000-01-02','develper',21000,10,'2019-02-02','o-','m');
Query OK, 1 row affected (0.34 sec)

mysql> insert into employee_info
    -> values(30,'ashin',9801348967,'ashin@gmail.com','2000-01-02','develper',21000,10,'2019-02-02','o-','m');
Query OK, 1 row affected (0.08 sec)

mysql> insert into employee_info
    -> values(40,'dinesh',9901348967,'dinesh@gmail.com','2010-21-02','develper',25000,10,'2018-02-02','a+','m');
ERROR 1292 (22007): Incorrect date value: '2010-21-02' for column 'dob' at row 1
mysql> insert into employee_info
    -> values(40,'dinesh',9901348967,'dinesh@gmail.com','2010-01-22','develper',25000,10,'2018-02-02','a+','m');
Query OK, 1 row affected (0.35 sec)

mysql> insert into employee_info
    -> values(50,'chaitra',9001348967,'chaitra@gmail.com','2001-01-22','tester',30000,20,'2018-01-02','a-','f');
Query OK, 1 row affected (0.13 sec)

mysql> insert into employee_info
    -> values(60,'bhavya',9001358967,'bavya@gmail.com','1998-01-22','analyst',40000,20,'2019-01-02','o+','f');
Query OK, 1 row affected (0.13 sec)

mysql> insert into employee_info
    -> values(70,'shwetha',9001358767,'shwetha@gmail.com','1995-01-22','hr',45000,30,'2019-01-10','o-','f');
Query OK, 1 row affected (0.35 sec)

mysql> insert into employee_info
    -> values(80,'bhumika',9001358567,'bhumika@gmail.com','1996-01-22','manager',27000,40,'2019-01-20','o-','f');
Query OK, 1 row affected (0.12 sec)

mysql>
mysql> insert into employee_info
    -> values(90,'dinga',9001358227,'dinga@gmail.com','1999-07-22','clerk',17000,10,'2019-01-20','o-','m');
Query OK, 1 row affected (0.13 sec)

mysql> insert into employee_info
    -> values(100,'dingi',9001353337,'dingi@gmail.com','2000-07-22','clerk',17000,10,'2019-05-20','b-','m');
Query OK, 1 row affected (0.35 sec)



mysql> select * from employee_info;
+-----+---------+------------+-------------------+------------+-------------+--------+--------+------------+------------+--------+
| eid | name    | mobile     | emaiid            | dob        | designation | salary | deptid | doj        | bloodgroup | gender |
+-----+---------+------------+-------------------+------------+-------------+--------+--------+------------+------------+--------+
|  10 | prashul | 9901348957 | prashul@gmail.com | 2000-01-01 | develper    |  20000 |     10 | 2019-02-01 | o+         | m      |
|  20 | dev     | 9901348967 | dev@gmail.com     | 2000-01-02 | develper    |  21000 |     10 | 2019-02-02 | o-         | m      |
|  30 | ashin   | 9801348967 | ashin@gmail.com   | 2000-01-02 | develper    |  21000 |     10 | 2019-02-02 | o-         | m      |
|  40 | dinesh  | 9901348967 | dinesh@gmail.com  | 2010-01-22 | develper    |  25000 |     10 | 2018-02-02 | a+         | m      |
|  50 | chaitra | 9001348967 | chaitra@gmail.com | 2001-01-22 | tester      |  30000 |     20 | 2018-01-02 | a-         | f      |
|  60 | bhavya  | 9001358967 | bavya@gmail.com   | 1998-01-22 | analyst     |  40000 |     20 | 2019-01-02 | o+         | f      |
|  70 | shwetha | 9001358767 | shwetha@gmail.com | 1995-01-22 | hr          |  45000 |     30 | 2019-01-10 | o-         | f      |
|  80 | bhumika | 9001358567 | bhumika@gmail.com | 1996-01-22 | manager     |  27000 |     40 | 2019-01-20 | o-         | f      |
|  90 | dinga   | 9001358227 | dinga@gmail.com   | 1999-07-22 | clerk       |  17000 |     10 | 2019-01-20 | o-         | m      |
| 100 | dingi   | 9001353337 | dingi@gmail.com   | 2000-07-22 | clerk       |  17000 |     10 | 2019-05-20 | b-         | m      |
+-----+---------+------------+-------------------+------------+-------------+--------+--------+------------+------------+--------+
10 rows in set (0.00 sec)



mysql> update employee_info
    -> set mobile =9922933884
    -> where eid =20;
Query OK, 1 row affected (0.08 sec)
Rows matched: 1  Changed: 1  Warnings: 0

mysql> update employee_info
    -> set mobile =9922933888
    -> where eid =30;
Query OK, 1 row affected (0.13 sec)
Rows matched: 1  Changed: 1  Warnings: 0

mysql> update employee_info
    -> set mobile =9922933800
    -> where eid =20;
Query OK, 1 row affected (0.36 sec)
Rows matched: 1  Changed: 1  Warnings: 0


 create table employee_info
    -> (eid int(5) not null unique primary key,
    -> name varchar(150) ,
    -> mobile long ,
    -> emaiid varchar(150),
    -> dob date,
    -> designation varchar(150),
    -> salary double,
    -> deptid int(5),
    -> doj date,
    -> bloodgroup varchar(150),
    -> gender varchar(150)
    -> );


mysql> insert into employee_info
    -> values(10,'prashul',9901348957,'prashul@gmail.com','2000-01-01','develper',20000,10,'2019-02-01','o+','m');
Query OK, 1 row affected (0.34 sec)

mysql> insert into employee_info
    -> values(20,'dev',9901348967,'dev@gmail.com','2000-01-02','develper',21000,10,'2019-02-02','o-','m');
Query OK, 1 row affected (0.34 sec)

mysql> insert into employee_info
    -> values(30,'ashin',9801348967,'ashin@gmail.com','2000-01-02','develper',21000,10,'2019-02-02','o-','m');
Query OK, 1 row affected (0.08 sec)

mysql> insert into employee_info
    -> values(40,'dinesh',9901348967,'dinesh@gmail.com','2010-21-02','develper',25000,10,'2018-02-02','a+','m');
ERROR 1292 (22007): Incorrect date value: '2010-21-02' for column 'dob' at row 1
mysql> insert into employee_info
    -> values(40,'dinesh',9901348967,'dinesh@gmail.com','2010-01-22','develper',25000,10,'2018-02-02','a+','m');
Query OK, 1 row affected (0.35 sec)

mysql> insert into employee_info
    -> values(50,'chaitra',9001348967,'chaitra@gmail.com','2001-01-22','tester',30000,20,'2018-01-02','a-','f');
Query OK, 1 row affected (0.13 sec)

mysql> insert into employee_info
    -> values(60,'bhavya',9001358967,'bavya@gmail.com','1998-01-22','analyst',40000,20,'2019-01-02','o+','f');
Query OK, 1 row affected (0.13 sec)

mysql> insert into employee_info
    -> values(70,'shwetha',9001358767,'shwetha@gmail.com','1995-01-22','hr',45000,30,'2019-01-10','o-','f');
Query OK, 1 row affected (0.35 sec)

mysql> insert into employee_info
    -> values(80,'bhumika',9001358567,'bhumika@gmail.com','1996-01-22','manager',27000,40,'2019-01-20','o-','f');
Query OK, 1 row affected (0.12 sec)

mysql>
mysql> insert into employee_info
    -> values(90,'dinga',9001358227,'dinga@gmail.com','1999-07-22','clerk',17000,10,'2019-01-20','o-','m');
Query OK, 1 row affected (0.13 sec)

mysql> insert into employee_info
    -> values(100,'dingi',9001353337,'dingi@gmail.com','2000-07-22','clerk',17000,10,'2019-05-20','b-','m');
Query OK, 1 row affected (0.35 sec)



mysql> select * from employee_info;
+-----+---------+------------+-------------------+------------+-------------+--------+--------+------------+------------+--------+
| eid | name    | mobile     | emaiid            | dob        | designation | salary | deptid | doj        | bloodgroup | gender |
+-----+---------+------------+-------------------+------------+-------------+--------+--------+------------+------------+--------+
|  10 | prashul | 9901348957 | prashul@gmail.com | 2000-01-01 | develper    |  20000 |     10 | 2019-02-01 | o+         | m      |
|  20 | dev     | 9922933800 | dev@gmail.com     | 2000-01-02 | develper    |  21000 |     10 | 2019-02-02 | o-         | m      |
|  30 | ashin   | 9922933888 | ashin@gmail.com   | 2000-01-02 | develper    |  21000 |     10 | 2019-02-02 | o-         | m      |
|  40 | dinesh  | 9922900000 | dinesh@gmail.com  | 2010-01-22 | develper    |  25000 |     10 | 2018-02-02 | a+         | m      |
|  50 | chaitra | 9001348967 | chaitra@gmail.com | 2001-01-22 | tester      |  30000 |     20 | 2018-01-02 | a-         | f      |
|  60 | bhavya  | 9001358967 | bavya@gmail.com   | 1998-01-22 | analyst     |  40000 |     20 | 2019-01-02 | o+         | f      |
|  70 | shwetha | 9001358767 | shwetha@gmail.com | 1995-01-22 | hr          |  45000 |     30 | 2019-01-10 | o-         | f      |
|  80 | bhumika | 9001358567 | bhumika@gmail.com | 1996-01-22 | manager     |  27000 |     40 | 2019-01-20 | o-         | f      |
|  90 | dinga   | 9001358227 | dinga@gmail.com   | 1999-07-22 | clerk       |  17000 |     10 | 2019-01-20 | o-         | m      |
| 100 | dingi   | 9001353337 | dingi@gmail.com   | 2000-07-22 | clerk       |  17000 |     10 | 2019-05-20 | b-         | f      |
+-----+---------+------------+-------------------+------------+-------------+--------+--------+------------+------------+--------+
10 rows in set (0.00 sec)


mysql> select * from employee_info where salary >2000 and eid >50;
+-----+---------+------------+-------------------+------------+-------------+--------+--------+------------+------------+--------+
| eid | name    | mobile     | emaiid            | dob        | designation | salary | deptid | doj        | bloodgroup | gender |
+-----+---------+------------+-------------------+------------+-------------+--------+--------+------------+------------+--------+
|  60 | bhavya  | 9001358967 | bavya@gmail.com   | 1998-01-22 | analyst     |  40000 |     20 | 2019-01-02 | o+         | f      |
|  70 | shwetha | 9001358767 | shwetha@gmail.com | 1995-01-22 | hr          |  45000 |     30 | 2019-01-10 | o-         | f      |
|  80 | bhumika | 9001358567 | bhumika@gmail.com | 1996-01-22 | manager     |  27000 |     40 | 2019-01-20 | o-         | f      |
|  90 | dinga   | 9001358227 | dinga@gmail.com   | 1999-07-22 | clerk       |  17000 |     10 | 2019-01-20 | o-         | m      |
| 100 | dingi   | 9001353337 | dingi@gmail.com   | 2000-07-22 | clerk       |  17000 |     10 | 2019-05-20 | b-         | f      |
+-----+---------+------------+-------------------+------------+-------------+--------+--------+------------+------------+--------+
5 rows in set (0.07 sec)